{"no_expert_validated_rules":true,"rules":[{"action_preference":"Take the sign of a trick's value from the contract and keep RAMI and NOLO on separate rule branches. The deal-point scale is exposed as +4 per trick for a RAMI declaring team, +8 for a RAMI defending partnership above the sixth trick, and -4 in NOLO. No policy may use one undifferentiated trick reward.","condition":"A policy compares candidate cards by trick value.","contracts":["NOLO","RAMI"],"implementing_profiles":["legacy_heuristic_port_v1","match_aware_no_match_features_v1","match_aware_v1","partner_aware_legacy_convention_v1","partner_aware_v1","public_counting_v1","reactive_contract_legacy_show_v1","reactive_contract_v1"],"independently_disableable":false,"limitations":"Marginal values are exact only away from the 6/7 boundary, where the swing is larger than one increment.","phases":["TRICK_PLAY"],"provenance":"mechanical","rationale":"The scoring formulas award 4*(declarer tricks - 6), 8*(defender tricks - 6) and 4*(7 - fewer tricks); the sign and the scale genuinely differ.","rule_id":"common.play.differentiated_trick_reward.v1","schema_version":"tuppi.agents.strategy_rule_catalogue.v1"},{"action_preference":"Consider only the actions present in PlayerObservation.legal_actions, in the engine's stable order.","condition":"A policy is asked for an action.","contracts":["NOLO","RAMI"],"implementing_profiles":["legacy_heuristic_port_v1","match_aware_no_match_features_v1","match_aware_v1","partner_aware_legacy_convention_v1","partner_aware_v1","public_counting_v1","reactive_contract_legacy_show_v1","reactive_contract_v1"],"independently_disableable":false,"limitations":"None; this is a restatement of the rules.","phases":["SHOWING","TRICK_PLAY"],"provenance":"mechanical","rationale":"The engine rejects illegal actions and never repairs them, so the legal set is the whole action space.","rule_id":"common.play.legal_actions_only.v1","schema_version":"tuppi.agents.strategy_rule_catalogue.v1"},{"action_preference":"Select the lexicographic maximum score vector; break ties by the lowest engine legal-action index.","condition":"More than one legal action remains after scoring.","contracts":["NOLO","RAMI"],"implementing_profiles":["legacy_heuristic_port_v1","match_aware_no_match_features_v1","match_aware_v1","partner_aware_legacy_convention_v1","partner_aware_v1","public_counting_v1","reactive_contract_legacy_show_v1","reactive_contract_v1"],"independently_disableable":false,"limitations":"The tie-break is arbitrary with respect to strength; it is chosen only for reproducibility.","phases":["SHOWING","TRICK_PLAY"],"provenance":"mechanical","rationale":"A single documented tie-break makes the policy reproducible without depending on set iteration or object identity.","rule_id":"common.select.deterministic_maximum.v1","schema_version":"tuppi.agents.strategy_rule_catalogue.v1"},{"action_preference":"Show only a card allowed by project_target_v1 valid_show_cards; accept the derived verbal_required flag.","condition":"A policy declares a contract during showing.","contracts":["NOLO","RAMI"],"implementing_profiles":["legacy_heuristic_port_v1","match_aware_no_match_features_v1","match_aware_v1","partner_aware_legacy_convention_v1","partner_aware_v1","public_counting_v1","reactive_contract_legacy_show_v1","reactive_contract_v1"],"independently_disableable":false,"limitations":"project_target_v1 has no cardless verbal declaration, so the legacy 'declare with no card' branch cannot be reproduced.","phases":["SHOWING"],"provenance":"mechanical","rationale":"project_target_v1 restricts show ranks to 3-9 and defines an explicit off-colour and no-eligible-rank fallback hierarchy.","rule_id":"common.show.authoritative_fallback.v1","schema_version":"tuppi.agents.strategy_rule_catalogue.v1"},{"action_preference":"Prefer to shed a card that is the highest unplayed card of its suit.","condition":"The policy may discard or safely lose in a NOLO deal.","contracts":["NOLO"],"implementing_profiles":["match_aware_no_match_features_v1","match_aware_v1","partner_aware_legacy_convention_v1","partner_aware_v1","public_counting_v1"],"independently_disableable":false,"limitations":"Shedding a top card can also strip a suit and force later wins elsewhere.","phases":["TRICK_PLAY"],"provenance":"generic_trick_taking_hypothesis","rationale":"A card that no unplayed card can beat is a guaranteed future trick, which is exactly what a misere contract must avoid.","rule_id":"counting.nolo.avoid_retaining_certain_winner.v1","schema_version":"tuppi.agents.strategy_rule_catalogue.v1"},{"action_preference":"Among the lowest-rank candidates, prefer the card with the most unaccounted higher cards in its suit.","condition":"The policy is on lead in a NOLO deal.","contracts":["NOLO"],"implementing_profiles":["match_aware_no_match_features_v1","match_aware_v1","partner_aware_legacy_convention_v1","partner_aware_v1","public_counting_v1"],"independently_disableable":false,"limitations":"A count is not a probability; the rule makes no claim about how those cards are distributed.","phases":["TRICK_PLAY"],"provenance":"generic_trick_taking_hypothesis","rationale":"The count of unaccounted higher cards is a hard public count, and a larger count means more cards that can take the trick instead of the leader.","rule_id":"counting.nolo.lead_suit_with_most_unaccounted_higher.v1","schema_version":"tuppi.agents.strategy_rule_catalogue.v1"},{"action_preference":"Prefer the cheapest such certain winner over a merely provisional winner.","condition":"The policy is following, an opponent holds the trick, and some legal card beats every led-suit card the remaining seats could still hold.","contracts":["RAMI"],"implementing_profiles":["match_aware_no_match_features_v1","match_aware_v1","partner_aware_legacy_convention_v1","partner_aware_v1","public_counting_v1"],"independently_disableable":false,"limitations":"Only as strong as the public record: an unaccounted higher card blocks the deduction even when nobody actually holds it.","phases":["TRICK_PLAY"],"provenance":"mechanical","rationale":"Hard public inference proves that no remaining seat can hold a higher card of the led suit, so the trick cannot be taken back.","rule_id":"counting.play.certain_winner_priority.v1","schema_version":"tuppi.agents.strategy_rule_catalogue.v1"},{"action_preference":"Prefer leading that card.","condition":"The policy is on lead and holds the highest unplayed card of some suit.","contracts":["RAMI"],"implementing_profiles":["match_aware_no_match_features_v1","match_aware_v1","partner_aware_legacy_convention_v1","partner_aware_v1","public_counting_v1"],"independently_disableable":false,"limitations":"Certain for this trick only; it says nothing about who leads the next one or about the rest of the deal.","phases":["TRICK_PLAY"],"provenance":"mechanical","rationale":"project_target_v1 has no trump suit and only led-suit cards can win, so the highest unplayed card of a suit wins with certainty when it is led.","rule_id":"counting.play.lead_certain_winner.v1","schema_version":"tuppi.agents.strategy_rule_catalogue.v1"},{"action_preference":"Discard by the frozen liability table, then a short-suit bonus, then the highest rank, then legacy suit precedence.","condition":"The legacy port cannot follow the led suit in NOLO.","contracts":["NOLO"],"implementing_profiles":["legacy_heuristic_port_v1"],"independently_disableable":false,"limitations":"The liability weights (4, 3, 2, 1, 0.5, 0.25) are uncalibrated legacy constants.","phases":["TRICK_PLAY"],"provenance":"legacy_port","rationale":"Ported verbatim from ``_nolo_discard_any``, including its use of full-hand suit lengths for the short-suit bonus.","rule_id":"legacy.nolo.discard_liability_table.v1","schema_version":"tuppi.agents.strategy_rule_catalogue.v1"},{"action_preference":"Play the highest led-suit card when last to play, otherwise the lowest.","condition":"The legacy port holds led-suit cards but none of them loses the trick.","contracts":["NOLO"],"implementing_profiles":["legacy_heuristic_port_v1"],"independently_disableable":false,"limitations":"The earlier-seat branch relies on some later seat actually overtaking.","phases":["TRICK_PLAY"],"provenance":"legacy_port","rationale":"Ported verbatim: the last seat cannot be overtaken and purges its largest liability, while an earlier seat keeps the trick cheap so a later seat can still take it.","rule_id":"legacy.nolo.forced_win_position_rule.v1","schema_version":"tuppi.agents.strategy_rule_catalogue.v1"},{"action_preference":"Play the highest card of the led suit that still loses.","condition":"The legacy port can follow suit and lose the trick.","contracts":["NOLO"],"implementing_profiles":["legacy_heuristic_port_v1"],"independently_disableable":false,"limitations":"The frozen branch considered only cards of the led suit, so a safe off-suit discard was never preferred while following.","phases":["TRICK_PLAY"],"provenance":"legacy_port","rationale":"Ported verbatim from the frozen NOLO follow branch.","rule_id":"legacy.nolo.highest_losing_card.v1","schema_version":"tuppi.agents.strategy_rule_catalogue.v1"},{"action_preference":"Prefer an exit card of rank 2-4, choosing the lowest rank and then the shortest suit; otherwise the lowest rank overall.","condition":"The legacy port is on lead in a NOLO deal.","contracts":["NOLO"],"implementing_profiles":["legacy_heuristic_port_v1"],"independently_disableable":false,"limitations":"The 2-4 exit band is an uncalibrated legacy constant.","phases":["TRICK_PLAY"],"provenance":"legacy_port","rationale":"Ported verbatim from the frozen NOLO lead branch.","rule_id":"legacy.nolo.lead_lowest_exit_shortest_suit.v1","schema_version":"tuppi.agents.strategy_rule_catalogue.v1"},{"action_preference":"Play the cheapest card of the led suit that beats the current best; otherwise the lowest card of the led suit; otherwise the lowest legal card.","condition":"The legacy port is following in a RAMI deal.","con